{
  "request_id": "55555555-5555-4555-8555-555555555555",
  "correlation_id": "66666666-6666-4666-8666-666666666666",
  "execution_plan_id": "99999999-9999-4999-8999-999999999999",
  "stable_plan_hash": "a8f7e75a4a4ea309803cf16fec43a4adb788ddcaa5589d91a9c00a41a8f56df7",
  "current_posture": "policy_preapproved",
  "state": "in_progress",
  "degraded_subtype": null,
  "started_at_utc": "2030-01-01T00:10:05Z",
  "updated_at_utc": "2030-01-01T00:10:07Z",
  "completed_at_utc": null,
  "current_step": "step_export_prepare",
  "completion_summary": null,
  "failure_summary": null,
  "truthful_user_visible_summary": "execution in progress on step_export_prepare"
}
